Dominant_Topic,Topic_Perc_Contrib,Text
6.0,0.1763,"Lost items, slow customer service (only available by email - the phones don't really work), and it's a hassle to get a reimbursement when you're missing clothes if you get a reimbursement at all. Not worth the steep price.I won't be using Cleanly again."
0.0,0.2484,"BEYOND TERRIBLE SERVICE. I'm not one to write reviews but I felt it necessary. This is the 5th time now I've had an issue with Cleanly services. Not once have they ever accommodated after each issue/damage. Customer service is pathetic. 1. Ripped and torn items (shirts, sheets)2. White duvet cover stained dark blue 3. Whites stained gray color 4. Requested and paid for overnight service and customer service replied 1 day later saying their driver was unable to complete the drop off and ultimately dropped off 3 days late - still charged for overnight fees.5. Most recently I received my white curtains heavily stained and ultimately had to throw them out (which I bought for $65) - at this time I was leaving on vacation for a week and did not report it until I returned. Customer service responded by saying ""since you reported after 7 day window we cannot do anything"" Needless to say, I will no longer use their services. They are unreliable and will end up costing you more money to replace your items that they damage. I recommend switching to ""FlyCleaners!!!!!"""
5.0,0.3761,"This was my first time using Cleanly. I decided to give it a try despite so many negative reviews online - that was mistake. I handed over 1 full size duvet cover, 1 full size fitted sheet and 2 standard pillow cases. The next day I received a text saying that my full size sheets did not fit in the washing machine and that they could not be hung dry. Therefore the two pillow cases would be washed and the sheets would be returned ""uncleaned.....""Huh? How are the washers  too small for standard full size sheets? The rinky-dink washers down my block can fit full sheets. Why could they not be hung dry? Again, they are standard full size sheets- not queen or King. Why accept full size sheets if you cannot actually wash or dry them?Lastly, I do not believe the pillow cases were even washed-- and ALL of the bedding came back crumpled, even the pieces that were not washed. This was an enormous waste of time. Just go through your local laundromat"
3.0,0.2138,Used cleanly again and they lost my entire bag of clothes. I will only get 10x what it cost to clean the clothes regardless of what it costs to replace them. Don't even know why I gave them a second chance.
0.0,0.2609,"****Updated review****I've attached 2 screenshots. Over 1 year, the price for washing bed sheets has went up $8 to $11, which is 37.5% mark up..... if you do the math. Their wash & fold price has also gone up 10 cent/lb now $1.6/lb. I literally just sent my laundry out 2 weeks ago in December 2018 and I can assure you it was $1.5/lb. It would be nice if customers were noticed of those price change. My #1 problem with cleanly is that they kept charging me extra, claiming the $2 bed sheets I got from Amazon deserves ""superior"" treatments. And each time I have to contact customer service to correct it. But how many people don't check their invoice or just don't give a fuck? I'm not even going to mention how many times cleanly misplaced my laundry items. Actually, the first time I used cleanly in 2017 summer, they lost my bf's brooks brother shirts! Yet I still decided to stick with cleanly. After returning to cleanly after taking a break and yet again, I found myself disappointed in cleanly's service. Nahhh fuck off cleanly, imma go & support local laundry mats. And this time I mean it! Whoever is reading this review, You should too."
3.0,0.1773,As per previous reviews absolutely horrible customer service constantly escalating things. Who are you escalating it to? Please give me a number of someone I can talk to that can make a decision. Also where are my clothes? They lost my bag completely. Absolutely appalling.
0.0,0.203,"This is the WORST DRYCLEANING SERVICE IN THE HISTORY OF DRYCLEANING. Every single time I've sent something out there's been a problem. My beautiful gowns that barely were worn and needed a basic DRYCLEANING/steam are destroyed by yellowing, discoloration, dye problems. Another time 2 of my husbands $500 Tom Ford shirts went missing. Their policy is to reimburse you 3x the cost of the DRYCLEANING-- that's like $15. So yourself a favor and stay far far away from this joke of a company."
1.0,0.2062,"Well I'm writing this now in hopes I'll get some kind of reply. They took my clothes two nights ago and I was supposed to receive them all yesterday morning (paid for the overnight fee) and waited an hour past the window. They told me there was an issue with my card and I said run it again, there's no issue. There's no response from them. You get an automated chat on the app with computer answers rather than an actual human. They have all of my workout clothes, work clothes and underwear. Which is really fun. I've used them before with no problems so I'm extremely upset. I would rather just go to this holding facility they claim to have my stuff at and go get my belongings back myself. Would like a phone call and resolution ASAP...I'll update if I hear anything."
0.0,0.1776,Cleanly lost $$$ thousands of dollars of designer clothes with zero help whatsoever in resolving the situation. No way of calling customer service and getting through to a human. All automated systems. No responsibility on their end. Their insurance doesn't even come close to the value of the garments that are missing. WORST SERVICE IN NYC. DO NOT USE THEM!!!!
3.0,0.181,"My friend warned me against this company when they lost an entire bag of laundry and didn't compensate him.  Alas.  I didn't listen.After changing the pick-up and delivery times on me without any notice, I still went through with my order.  That should have been my first sign because they completely ruined my garment. I am still waiting to see if they plan on reimbursing me."
6.0,0.2092,"Worst online dry cleaning service I have ever used. Is is not cleaned well, it is not folded well. They have lost a very important item that they are incapable of finding for whatever reason.Save yourself the trouble."
6.0,0.2267,"I am so livid right now, my sister had couple of cashmere sweaters. Their delivery service lost them. How the hell do you lose clothing like that when there's an app with the receipt they sent her!! And then because they lost or misplaced or whatever, they haven't decided if they are gonna reimburse for her clothes their delivery service lost!!!! WTF, we will never use them again!  DO NOT DO NOT USE THEIR DELIVERY SERVICES!!! Only if you want to get rid of clothes you don't want, they'll be glad to lose them for you!!! Disappointed and disrespectful!"
2.0,0.1991,"Great idea, terrible execution. Don't waste your stress or time dealing with them. Go to your local laundromat.I used them for about 6 months and was very satisfied and now the problems are way too frequent. First, there was an issue with them honoring a credit I earned for taking a survey. It took about 6 emails back and forth to get it resolved. It should've taken 2. It was simple. They were supposed to credit my card back. Never did. I stopped using them because of that. Used a local laundromat. Just used them again for the first time since and they were late picking up my laundry by an hour and now they have to reschedule my drop off because the ""concierge has an emergency"" and they can't add me back to the drop off list. Really Cleanly? They seriously need to hire a management company to help them work through the kinks and fix their operations issues because after paying $50 for wash and fold, my expectations, as the paying customer, is to get what I paid for. Plus, I waited on hold for 30 minutes just to speak with someone.Now, if and when I get my clothes, because I'm sure there will be another issue, since they always have issues, I will be deleting the app and will not be giving them a third time to screw me over."
6.0,0.2589,"Long and short of it, from pick up to cleaning, somewhere in the process, Cleanly lost my suit.  I reached out to their customer service when it became apparent something was awry, as the suit had not delivered 3 days after the delivery date.  I was told they could not locate the item, and they would initiate an inquiry in which they would give themselves 10 days to find the suit.After 10 days, I reached out again, having heard nothing from their POC, who let me know that if they could not find it, they would only compensate me for 10x the cost of cleaning (approx $150 dollars), not the actual replacement value of the suit.  That is about an $800 dollar difference between those two numbers, without tailoring or other factors included.  When I had Nordstroms reprint the receipt, provided tags, etc, and they did not feel that warranted a different review.  This policy is not located on their Ap, nor is it anywhere to be found when you agree to their pickup/delivery.  Seeing as they have were not proactive in identifying the issue, they were unwilling to volunteer information as to the status of the inquiry and totally unwilling to work with me to provide the replacement value for an item, I would not recommend using this service."
1.0,0.199,"TERRIBLE. My husband sent out 12 shirts to be laundered and pressed, they all came back wrinkled. Maybe if they buttoned them they would have not wrinkled during transport. This is awesome, because we both really want to spend all night ironing, can't wait to get started. Thanks cleanly!  Trying to call them, they aren't picking up, shoc.  We've had issues before with them, this is the last straw. After calling and sending photos, they REFUSE to give us a refund!!!   UNBELIEVABLE"
3.0,0.2069,"Lost my whole bag of laundry! Called cleanly 4 times and got hung up each time. Messaged them and was told that my valet already dropped off with a ""doorman"". I live in a townhouse there's no doorman! When asked where they brought my clothes and how to get in contact with the person that dropped it off at the wrong address, they completely ignored my questions and just told me to wait. My valet never called, and I never found out where my clothes was brought or how they manage to loose a whole bag of clothes."
6.0,0.1861,The worst customer service! The first bad experience I had with this company was when their delivery was 24 hours late and didn't get reimbursed for the wasted time. 2nd time was when I recently got my laundry back and one of my expensive shirts were ruined. I contacted cleanly and told them the situation. They said unfortunately they can't reimburse me for the shirt that THEY damaged. I would definitely go with another company.
2.0,0.2758,"I want to love Cleanly, I really do, but this latest fiasco has made me delete the app. When they get it right, they get it right. It's one of the few places that you could (in theory) count on unscented laundry detergent if that was your selection. Since I have fragrance sensitivity, that's a big deal. So I've dealt with their semi-frequent annoying screw ups (washing in scented detergent, charging for things they shouldn't charge for pretty much every order, etc). When they get it wrong, through: forget it. I'm done.For the second time, their concierge just had an ""emergency"" and they canceled my pickup at the last minute. I had scheduled a pickup and drop-off in plenty of time to have clean clothes to pack for a trip. I get a text right before pickup time saying, gee, sorry, they had an emergency and changed my pickup time to *after* I will be living on my trip. A back-and-forth with customer service was useless. So now I have to take two hours off work tomorrow to do laundry that I could have dropped off somewhere if Cleanly hadn't run out the clock. They deserve to go under. The customer service is the pits. Find another laundry app."
2.0,0.3684,"I've been a loyal member for years. To echo other reviewers, it really has gone downhill the past 3-4 months.I share the same experience of not being able to contact customer service because they don't pick up, and them rescheduling my drop off literally at the end of the drop off time window.Right now I'm on yet another call (15 mins on hold) because I'm flying to Buffalo and then Canada tomorrow morning and they have rescheduled my 8-9pm drop off window tonight to the next day for absolutely no reason. Now I have no gym clothes and only one pair of jeans to last me a whole week of travel. And my jackets are also held hostage by them. This is insane. I planned my drop off tonight for a reason, but this is not the first time I needed clothes and had them reschedule on me at the last minute. It's the last straw. After hundreds of dollars with them, I'm moving into an apartment with a washer and dryer on 6/1 and ditching them forever. I suggest you do too."
0.0,0.1746,"Awful. They are CONSTANTLY losing your laundry. Terrible communication. I've had their customer service say, ""oh I remember you. We've lost your stuff before right?"" Seriously. Their delivery people will be the first to tell you how bad they are. I've used them for several months. Gave them more chances than anyone would. My only advice is just stay away. It's not worth it. One more thing, their excuse is that they are switching their delivery drives from ""consultants"" to full time employees. They have been using this excuse for MONTHS. Even the customer service rep I spoke to last time used it. And when I told her they always say that, she says d she knows and apologized again. Shame."
1.0,0.1792,"Horrible. I used them for a few months but have finally gotten fed up and decided to just go to a laundromat. tl;drTheir customer service is minimal, and you don't know what you've got til it's gone (with the clothing they lost)1) They provide no easy way to contact the people who are dropping off/picking up your clothes, so when they do things like forget to deliver some of your clothes, it becomes a huge ordeal to fix instead of a minor hassle. 2) They lost my clothes right before I went on vacation. Due to #1, this became a huge problem. That's also when I found out that their policy on their website is to reimburse you for no more than 10 times the cost of washing the item (cleanly.com/terms), which means the most you'll get back for a lost shirt that you ordered hang dry ($1 charge) is $10. 3) They provide no clear customer service information on their website. If you dig long and hard you can find a phone number on some page, but there are no customer service hours posted. You won't find out you're calling after hours until you're on hold with their inane hold music for an hour--when no one picks up, it just keeps you on hold forever. 4) They don't return the bags you send out. I used to get hang dry service, then the cleaners stopped returning the hang dry bags. When I eventually contacted customer service they told me they were no longer using hang dry bags, there's just a special pocket inside the normal laundry bag--but they didn't have any more normal bags they could deliver to me and wouldn't have them for another week or two.5) They're frequently delayed when delivering clothing and they need to reschedule, especially if you try to get them to deliver in the morning."
3.0,0.1961,"Astounding amount of waste for just a few dry cleaned shirts. Completely unnecessary paper, and they should deliver in reusable bags (perhaps charge you if you don't return it next time with dirty shirts). At the very least they could group the shirts.Look at this nonsense! Unacceptable."
1.0,0.2271,"DO NOT USE - They are the FYRE Festival of laundry delivery services. Build it and advertise it now and figure out how to actually make it function later.I will NEVER use Cleanly again and don't recommend it if you'd worry if your laundry goes missing. I had a HORRIBLE experience the first time I used them and would give zero stars if possible. Next time I will just drop off my laundry at the local laundromat down the street.Here's what happened: I paid extra for rush service. A friendly guy picked up the laundry on time in the morning and it was due back that evening between 8-9. At 8:25 I got a text that it had been delivered but it hadn't been. When I tried to call them to clarify, I was on hold for an hour. When a rep picked up, he heard my complaint and then pretended not to be able to hear me, like the connection was bad, and then hung up on me! I tried to use their chat support and the rep wasn't very helpful, saying the laundry had been delivered when it clearly was lost. Finally, he got word that the laundry was still in fact at their vendor's facility and couldn't be delivered until 8 PM the next day. (I had sent my bed sheets, so this was a huge bummer!)They then charged my credit card AGAIN for the new delivery and didn't cancel the first charge or refund the rush service fee.The customer service was AWFUL and unapologetic, and they're not reliable. I would only trust clothes/sheets I really don't care about seeing again with them."
3.0,0.2262,"NEVER USE CLEANLY. THEY LOST/STOLE ~$400+ of my clothes. such as my Brooks Brothers clothes, Jcrew, H&M...etc. I see another review that they lost Brooks Brothers clothes as well...looks like a pattern. I will not let them get away with this."
1.0,0.1822,"Incompetent ""managers""/customer service reps that will only text instead of calling. They consistently over or double charge me for dry cleaning items."
6.0,0.2263,"I used Cleanly for the first time last week -- we used them for laundry service and dry cleaning. They have since lost my dry cleaning and are extremely slow to respond via their customer service channels. They actually tried to hide the fact that the dry cleaning was misplaced by delaying the return of the full order. My laundry was returned 24 hours after it was promised, but the dry cleaning is no where to be found. What's worse, I've only received canned responses with multi-day lags between emails. In fact, I only got an acknowledgement of the problem after tweeting at them directly. It is now 8 days later, and I am still waiting for a response as to the two dresses that are lost. I understand that mistakes happen but their utter refusal to acknowledge the problem is utterly infuriating. I only want my items returned. Maybe by seeing this post the customer service team will actually respond to their email. Do not use this service."
0.0,0.1954,Pretty much the worst. Terrible customer service response times. They lose a good amount of your laundry
2.0,0.4029,"I never write reviews, especially negative ones, but my experience was so overwhelmingly negative I feel the need to save other people the hassle. The entire purpose of this service is convenience but they fall well short of that. Save yourself the time, money, and stress. I work a lot, travel, and live alone so I wanted to try this out because I was rarely home when the laundromat near me is open - I leave home before 6 am and usually don't get back until after 8 or 9. Cleanly ended up making laundry even more frustrating. I'd rush back only to have them cancel my pick up. My ""hang dry"" clothes were returned soaking wet (like actually dripping). The app wouldn't acknowledge my change requests. My Cleanly bag and clothes were returned smelling like stale cigarettes. The final straw for me was this week after returning from a trip and desperately needing my laundry done before returning to work less than 12 hours after a long 36-hour trip home. I scheduled three different pick up windows and all were either cancelled (after an hour of waiting PAST the pickup window) or they didn't show up prompting me to cancel and be charged a fee. I was charged several times as a ""no show"" when I was home (concierge didn't even bother to follow the instructions for buzzing up to my apartment) and I only had one successful pick up / drop off in 2 months where I didn't have to reschedule more than once due to the concierge being late. I always tried to schedule pick ups before I leave for work and ended up being late when waiting for them to show up. Honestly can't say a single positive thing other than I am *fairly* certain none of my clothes were lost. Then again, I guess it's hard to lose them if you never come pick them up."
6.0,0.2796,"I've used Cleanly twice, once smoothly without a hitch and once as if I was in a never-ending nightmare of lost laundry. This is the story of the latter. Here's the summary: Cleanly picked up 2 bags of laundry from me, one with my shirts to be dry cleaned, another with laundry to be washed. I had 20-30 shirts and about 30-40lbs of wash and fold laundry (I suck at doing laundry regularly..hence trying Cleanly despite mixed reviews). A day goes by and I receive a text message (July 30) from the fulfillment center saying they can't immediately locate my laundry. Later, after an hour on the phone, Cleanly confirms that they've lost my bag with the 30-40lbs of wash and fold (thank god I didn't lose every dress shirt I've ever worn..trying to stay positive). They ask as ""corporate policy"" for a 10 business day time window to investigate during which they wouldn't even talk about reimbursement. I ask them to reimburse me at least for socks & underwear I have to buy to bridge me the 10 days...denied. Finally on Aug 16, I get a quote for reimbursement....at a rate of 10 times the cost to wash (ie. at the $1.50/lb rate for wash and fold, I would get $15 dollars for every pound of clothes lost). To put in perspective, this is the equivalent of a car wash compensating someone $150 for completely destroying/losing their car. If that wasn't enough, they quote me for 17lbs of clothes, ~ half of what the bag actually weighed. When I ask for specific internal documentation on the actual weight of the bag, Cleanly quickly attributed the prior weight quote as ""human error"" and agreed to compensate me for 30lbs, what I thought my clothes weighed in the first place. The question I would ask before using Cleanly are these - Is the convenience worth it for the risk of losing your entire wardrobe and receiving almost no compensation? Do you want to do business with a company that obviously tries to get away (fraudulently in the case of my weight quote) with paying less for reimbursement? As is always the case, you never see someone's true colors until things go south. My situation is still in dispute. I am currently seeking to file my case in New York Small Claims Court. My back-and-forth with Cleanly documenting the ordeal is below. You can decide for yourself if the risk is worth taking."
1.0,0.1889,Awful! I keep getting back the wrong items! And it is impossible to get a customer service representative on the phone!!! Will not be using them again. Would rather do my own laundry.
5.0,0.1948,"I wouldn't recommend using this app to anyone. I recently used it for the first time and my laundry was delivered to the wrong building. You can't even contact the dispatcher and no one answers the phone. They give you an option to have someone call you back but they don't actually do it. After an hour of trying to track down my laundry it ended up being in the wrong building. The company refused to refund me or do anything for me as a dissatisfied customer. Trust me, you're better off hand washing your clothes than using this horrific service."
2.0,0.2343,"I was a regular Cleanly customer for over a year. I had very few problems until recently. Near the beginning of the year, I got my laundry bag back saturated in cigarette smoke. The smell was so strong that I just threw the bag away. I had to have the clothes rewashed. My last ordered was rescheduled at the last minute by Cleanly. Now, I've been patiently waiting for the Cleanly person to come pick up my clothes. I got a notification that they're on the way. The tracker showed them about a mile away. I then noticed an email from Cleanly saying I was a no show for the pickup, but the email said they're waving the $5 fee. I can't believe how quickly the service has gone down hill."
