Dominant_Topic,Topic_Perc_Contrib,Text
4.0,0.1947,"This company is the Bermuda Triangle of laundry services. I've used Cleanly twice and while the first experience was bad, this second one has been horrendous. Back in October, my hang dry items were left behind -- I had to call several times to get the items returned to me. Now, they've lost an entire bag of my laundry and it's been a massive headache to try to track it down. Did you know that Cleanly has 20 days to do a ""thorough search"" before your items can be deemed lost? Yeah, I didn't either since that information is not available on their website nor their app since the link to their policy does not work. On March 30, Matthew from the support team said he would circle back with the staff to fix the link so future customers would be privy to this preposterous rule but the link still doesn't work.I've emailed back and forth with the support team about reaching a conclusion but I get no more than the same lines parroted back about waiting 20 days before commencing the reimbursement policy. No business that values its customers would make them wait nearly 3 weeks to find out about the status of their items."
6.0,0.1719,"EDIT: Scroll to the bottom and look at the ""not recommended"" reviews...100+ people with similar experiences. Do not be fooled by the ""convenience"" of this service...you'll end up spending more time dealing with their customer service and being stressed and frustrated than you would've saved.A few months ago, Cleanly somehow lost most of my 26 lb order of laundry. Returned to me at the dropoff time was some guy's clothing and couple of pieces of my own. After about a month of emailing back and forth with their customer service (and only receiving updates after following up multiple times), a couple of more items of my clothing were located and returned to me, but I still had to haggle for reimbursement for the remainder. They eventually gave me $750 (which is, honestly, generous, but still doesn't put a dent in replacing ~20 POUNDS of clothing from my closet that vanished on their watch) plus $250 in Cleanly credit. If this happens to you and they tell you the max they can reimburse you is $200, keep pushing. A few days ago I gave Cleanly another chance with my dry cleaning, since each piece is itemized unlike laundry, and because I still had this $250 credit to spend. Within less than 3 hours of the scheduled drop off time, I get a text saying unfortunately my clothing won't be ready and they need to reschedule. This is a minor inconvenience compared to most of my clothing being completely lost, but shouldn't happen to customers regardless. Needless to say I won't be using Cleanly again, and highly suggest you think twice before trusting this company with your wardrobe."
2.0,0.1963,"I've unfortunately had two terrible experiences with Cleanly. The first time, they wrote to me at the end of my pickup time that the valet was going to be 20 minutes late (when I was already late for work). They also wrongly charged me for dry cleaning when I had hang dry items. I was refunded, but their valets seem to be very misinformed.The second time, my pickup was cancelled 20 minutes prior, and I rearranged my entire schedule to make sure I was there for it. Not only that: once I received my order, I realized that they misplaced my hang dry items. I stressed to both customer services representatives that I needed these items before a trip and (obviously) it was not noted or taken seriously. I had to purchase new clothing for an event that I needed as a result. My compensation from Cleanly was $5.Additionally, I don't feel as though my clothes were clean. Some came back looking just as dirty as when I sent them off.The one thing I will commend is their customer service. Matthew was apologetic, polite and helpful during each of these instances. Unfortunately, he is one person and not a reflection of the company's service. I will not be using it again."
0.0,0.2356,"Horrible service, horrible customer service, they will ruin your cloths or lose them. Best advice is to stay away. Also, I'm pretty sure that all the positive reviews here are simply FAKE- look at all the negative ones and the positives in between- they are clearly trying to DISTRACT you"
1.0,0.1735,"Do not follow washing instructions (i.e. scented/unscented detergent, hang dry, etc). I've reached out multiple times to customer service and have been met with an automated response each time. Will no longer be using this service despite it being extremely convenient."
6.0,0.2538,"They value lost and damaged property on weight of the item, rather than value. DO NOT USE THIS SERVICE. The risk is enormous (I've had items lost and returned damaged multiple times) and the apology they offer (i.e. $50 in return for losing $175 worth of property, because the items weighed 2.5 pounds, by their estimation) is insulting."
4.0,0.2082,"This company used to be amazing - great customer service, good services.  However, the last few times I used the company, I have not gotten all my items and had to follow up with the company to either 1. find them, or 2. schedule a second delivery.  It defeats the purpose of having a delivery dry cleaning company.  Do not use this company unless you want to have to chase down your dry cleaning order.  Sad!"
2.0,0.1726,They have the all time worst customer service. I implicitly asked for them to have my laundry brought up to my apartment and they left it downstairs. When speaking with customer service their response was sorry and issues me 1$ off really? I had to lug 30 lb worth of laundry upstairs and was late for work
2.0,0.2725,"I used Cleanly for the first time, and no one ever came to pick up my laundry.  I had selected a time frame in the morning before work, and it kept getting pushed back by 20 minutes.  I kept waiting each 20 minute interval they pushed me back, until it made me late for work!  Finally, I gave up and left for work.  When I went to reschedule, I could request a time for that evening, but the dropoff time frame I had originally picked was no longer available!  There were no more drop off times available for the next 2 days!  Needless to say, I won't be using this service again."
3.0,0.1708,Do NOT use Cleanly unless you want to lose all of your clothes. They lost my entire bag of clothes and did not provide any refund for my belongings. Their customer service is also terrible. They did not answer their phone so do not even waste your time. I had been using them for over a year. I was a loyal customer- and then they lost all of my clothes and would not even give me an answer about what happened.
6.0,0.1767,"I've used this company a couple of times and with each order the quality and service got progressively worse. My items had marks on them, some shirts had wrinkles and on my last order part of my garment went missing (a shirt that had ties and one of the ties didn't come back). Needless to say that was the last straw. If you care about your clothes, DO NOT use Cleanly."
5.0,0.2279,"Definitely does not live up to the hype.  I've been using a local laundry service for years, but decided to give Cleanly a try after my friend sent me a referral code for $10 off.  Cleanly wants to upcharge for doing same day wash and fold (which my previous place did not), also wants to charge $1.50 for each pound in comparison to the $0.80 that my regular place charges. I will say that my clothes came back clean, but they lost one of my high end running socks.  Which now means I'm out a $16 pair of socks, because I can't just use one sock for running.  It took them 10 days to come up with a solution, which was ""here's $8 to use on cleanly"" or ""Here's $5 in cash"" Can't exactly replace my $16 socks with $5.  Needless to say, I will not be using them again or recommending them to anyone else. Stick with the local laundry for better service and faster turn around times."
2.0,0.1866,"Cleanly asked me for my feedback...so I figured I'd share here too...the only reason for the second star is because they didn't lose my clothing as another poster has mentioned. Are you really sure you want me to answer this??? I think Cleanly sucks as a service and the ""concierge"" are a bunch of pompous jerks who speak down to you when you have a valid complaint. 1- Cleanly said my method of payment was not accepted (ApplePay)...so I went on and entered the exact card attached to that account and *magically* it worked. Btw thanks for letting me know at 9:15pm when I was in bed and needed to get up to grab the EXACT same card (did I mention that??) 2- My hang to DRY clothing came back wet, not damp, wet. I'm very accustomed to doing my own laundry and it was quite evident my items had been washed that morning. When I inquired I was met with a generic and frankly rude response essentially explaining the process of laundering to me....thanks for that. I was told there were many factors that influence why the items might come back wet, there was absolutely no accountability taken. If you washed the hang to dry items upon receipt, it would control many of the ""factors"", its laundry, not rocket science. 3- It was of poor quality and expensive. I've used other laundering services for half the price and my items came back in way better condition.4- You've lost me as a future client and if you have Yelp you can expect a ""lovely"" review from yours truly as well.Glad you asked. Have a nice day"
2.0,0.2004,"The idea is to save time, but I ended up having my time wasted by Cleanly. The pickup was fine but the return a disaster. I was supposed to get my clothes back between 6:30 and 7:30 a.m. and at 7:45 I called to find out if there was a slight delay. I was told there was a delay of about three hours. Why I wasn't informed of that earlier than when I called, I'm not sure. But I don't have a doorman and needed to wait for my clothes which is why I requested the 6:30-7:30 slot so I could go on with my day. Not using this app again."
6.0,0.2226,"Stay away from this company. I enjoyed their services until recently. On my last order, my dry cleaning was delayed for over two days. Then a new driver dropped my clothing off in the wrong place. My dry cleaning was stolen and I lost over $800 worth of clothing. I contacted them to let them know I will be pursuing legal action and nobody has contacted me to follow-up. Please stay away from them and try other services that will actually care about your personal items."
2.0,0.1907,The concierge showed up an hour late. I had already left to work. Don't waste your time with this service.
3.0,0.2236,"My experience with this service was absolutely atrocious in a surprisingly varied number of ways. First and most importantly, when our multiple loads of laundry were delivered on Monday evening, a whole load was MISSING. When I contacted them about this, they said they'd take 7 business days (business days being Mon-Fri despite the fact that they are open on weekends, giving them a total of 9 days) to figure it out, and keep us apprised. After 3 days of our continuous checking in with no new information from them, they told us they had delivered the laundry to another customer and would send us pictures in the next couple of days to confirm. This never happened, and after continuous contact from us, they keep giving us the ""we will sort it out within 7 business days"" line.So, now it's Monday, a full week since the laundry was supposed to be delivered, and I am out of clothing. We don't know whether our laundry has actually been located or is missing, and they have been completely unapologetic, saying they have until Thursday to deal with it (I don't know who does their math).They have not even refunded this order!!! Additionally (and be *very* aware of this if you use this service), if our laundry does end up being missing, they will only replace each item with ""7 times the cost of CLEANING it."" Meaning that at $1.50/lb, a $15, 0.2 lb pair of underwear would get you a reimbursement of (up to!) 30 cents! At most we'd get $200 for clothes worth at the very least 4 times that.There have also been a fun assortment of other issues (the valet not bringing enough laundry bags necessitating a second pick-up the next day, delivery being delayed, a tiny bleach stain on a dark tee, a $20 groupon marked as having been applied to the total but them charging the full amount and it taking countless customer service interactions for them to fix this).At this point, I don't even care, I just want my laundry back. I will never be able to afford to replace what I lost given their reimbursement rates, and I loved that stuff.Outrageously bad. For your own sake I urge you to find another laundry service."
4.0,0.2034,"Cleanly has recently switched to a model where couriers are now employees of the firm. It now takes 3 days to schedule a pick-up and they are extremely unreliable. I scheduled 4 pick-ups last week, none of which were successful. I didn't get an email or a text, and the customer service representatives were extremely unhelpful and dismissive. Stay away!"
5.0,0.1959,"Good idea and nice customer service, poorly executed. After some back and forth with them realized they are simply a high tech middle layer - your laundry still goes to the same sweatshop wholesaler your local dry cleaner sends it out to. There are no pleasant trader joe employee happy hipsters gingerly doing your laundry at a cleanly owned facility. If anything goes wrong or there is inconsistency, they can still blame it on the vendor or say they are just getting started and bear with them. Nice to have interface, app, and text message, but simply paying a premium for same old laundry service. Laundry bag came back ripped after first try, gym clothes still smelt like sweat, socks and underwear not folded or inconsistently folded and some missing. Only had two try's so no horror stories like whole load went missing so I am sure some people had good experiences.Very similar to synergy maids who they were spun out of it. My first few tries with synergy maids were extremely inconsistent and frustrating but after raking management over the coals several times they finally got it right and are now quite pleasant and very convenient. If you've got the time and energy to go after them until right or you just really don't care that much about your laundry, give then a try."
4.0,0.2345,"I've been a frequent Cleanly customer over the past year, but when I moved to Brooklyn the Cleanly customer service and actual laundry third party vendor has been absolutely disappointing. I even had to repeatedly email Cleanly to get my money back, actually a CREDIT back even after showing them pictures of my clothes still wrinkled and with stains on them. Come on, a credit? I was almost willing to use them again until they told me that it is not guaranteed when exactly they'd tell the dry cleaners that they failed to actually clean my clothes. As someone whose spent more than $500 over the past few months with Cleanly, I'd expect a refund and some coupons on top of that. If you're in the midtown Manhattan area, Cleanly is great and their service is great as well. But, Brooklyn, beware."
5.0,0.1985,"I made the mistake of assuming a hip, innovative company would use non-toxic products. Instead my husband was very allergic so inquried--and they use very toxic products. They were not very apologetic when I confronted them about this. A mainstream, mediocre service at best."
4.0,0.2214,"I've used this service for a bit happily but am now going to stop. DON'T PAY FOR MEMBERSHIP. I pay the highest level of membership and was guaranteed rush delivery overnight and not only did they change that at the last Minute it's now going to be almost two full days without a drop off. I wouldn't have sent ALL my laundry out if i knew they'd screw thjs up since now i have a trip to go on and no clothes for it. I emailed customer service twice and no response and finally called and the woman couldn't do anything for me except move the delivery up by one hour. No refund or compensation and I was told that escalated management would get back to me in ""several days."" Way to treat high paying customers. Lost my business for sure and will tell other friends in the city not to try."
1.0,0.2254,"Avoid this service at all costs!! BY FAR the worst customer service I have ever experienced. Valets do not come to your door often, and will either just leave things at your door step with out knocking, or not show up at all. Just this week the following have occurred on 1 order.1. Valet was supposed to arrive Sunday. Called me asking for my address (which was already in the application and my order), then no-showed and didn't answer his phone. He subsequently claimed I was a no-show and charged me $5 for the ""no-show"". 2. 2nd Try Valet comes back on Monday. Arrives 30 minutes late, with no notice.3. Receive bill for ~$100, which included 30+ pounds of someone else's wash and fold clothing, as well as 3 sets of bedding (not mine), someone's dry cleaning.4. Received ""adjusted bill"" that was even higher, after I called support and relayed all these issues.5. Spoke to support again for 30+ minutes, who sent me pictures of clothes and items in question. I pointed out specifically which items were not mine, and she assured me that they would not be included in the delivery, and added that the valet would WAIT at the door and take back any other items that weren't mine. 6. Valet doesn't call or knock. I find the clothes outside my door, with no valet around. I have 30+ pounds of clothing that are not mine, dry cleaned shirts that aren't mine, and 3 sets of sheets and multiple towels that aren't mine.7. Clothes of mine are lost.For one that outsources their laundry, the notion of losing clothes is frightening, as you send off your often expensive clothing to a service with the promise that they are taking care and protecting it from being lost. For this to happen and the customer service associates to be so irresponsible is scary. I would recommend anyone to use RINSE, and NEVER use this service. Rinse I have never had a problem with and they are quick to apologize and fix an issues they caused with compensation or otherwise. PLEASE DO NOT USE CLEANLY."
4.0,0.2216,"I have used Cleanly for over a year, initially I was very happy with the service. However, they made a change in their concierge model (previously contract workers but they moved to hiring part time employees directly) and their hours became very limited, when they were running late they would often cancel and change the delivery to several days later (as one worker told me ""to avoid having to pay staff overtime"") and their prices went up as a result of this change. A service fee on all orders on top of delivery. This charge was even applied to people paying monthly for the Cleanly Reserve membership (which includes free shipping, etc). My last drop off instructions were not followed. I requested the clothes be brought to my door so I could ensure all the pieces were there, but they left the items with the doorman.  When my boyfriend picked them up, my hang dry items were not there. It has been over two weeks and I have not received an update on my missing items. The customer service is horrendous and overall quality has went down significantly. I would not recommend using this service."
6.0,0.2077,"I've used the service 3 times. Initially impressed with delivery flexibility and customer service until they LOST AN ENTIRE ORDER of 7 shirts I sent out for cleaning. They didn't lose one shirt - they LOST THE ENTIRE ORDER. They offered to pay me at 10x the cleaning value per lost item ($2.85/shirt), but this nowhere near covers their value and my out-of-pocket expenses. Not to mention that lost/stolen property of any kind is a total violation of trust; especially when you champion your company as a service provider. My advice: stick to your local where they know your face and respect your personal property."
0.0,0.1773,"This company baffles me. It's convenient for me so I use them but they make a ton of mistakes and though they charge a lot they are not at all generous with their customers when they screw up. They're just like ""sorry, remind us next time!"" and I do and they drop the ball time and time again and often don't even write back. They started out great but as they've increased their prices the service has sadly gotten worse."
3.0,0.1647,"they dried a load that was supposed to be hang-dry. ruined a thousand dollars worth of clothes. WTHthis was our second ever order. the first order, the delivery person rang the doorbell and by the time i got to the door he or she was already gone and reported me a no-show. WTH also it's expensive af"
4.0,0.1719,Delivered our clothes with over half of them missing. Refused to provide any compensation. I could never trust them again and definitely would not recommend.
6.0,0.202,"DO NOT use this service if you care about your items. 1. It's RIDICULOUSLY expensive. 2. They WILL lose your items. I've lost a $175 duvet and several smaller things. Customer service WILL NOT help you, refund your order, or anything. I've been trying to contact them for 2 days now, leaving voicemails, nothing... SCAM!!!!!!"
1.0,0.3706,"I have so far had a horrible experience with this service. The pickup went fine and as scheduled, but my planned delivery never occurred. I scheduled it for 8am to 9am, and at 8:01 received a text message saying my items were on their way. I patiently waited for them in my hotel room and never received my clothes during the allotted window. I called their customer service at 9am to ask for an update, and the person I spoke to apologized and said that there was a delay, and I should get my delivery at 10am. By 10am I had not received anything so called again and after being put on hold for 20 minutes, was told by the automated system to leave a message, which I did. I also followed up with an email asking for them to contact me with an update. I received an email apologizing for the delay and saying that I would receive a $5 credit to my account. I emailed again asking for a time of delivery and never heard back. I have called multiple times now and with the exception of the first call at 9am, have spent over an hour cumulatively on hold without anyone picking up. I have also sent multiple follow-up emails with no response. I find this very unprofessional and concerning."
0.0,0.2358,"The first time I used this app everything went smoothly. I was super happy with how everything came back until I could smell the detergent and fabric softener. I requested the non scented and no softener, reached out, customer service offered to have it re washed for free. I declined.I said I'd never use it again but my crazy busy schedule made me give it another try. Pick up yesterday was fine. However I'm now sitting here wondering where my clothes are since it was supposedly delivered 45 minutes ago and is nowhere to be found in my building. They're still confirming that the valet has my bag of laundry and I have to wait for potentially another hour and half to see if I'll receive the correct clothes I need to wear to a clinical shift tomorrow. Two stars because customer service is responsive, but really not that helpful. They offered me 20% off my next order, but I definitely won't be using it again."
0.0,0.1911,"I have used other cleaning services, but I must say Cleanly is the best. First their app is seamless. It works fast and is very clear. Secondly their pick up and delivery are always on time and get it right. That is a big thing since that is where I often had problems with other services. I also subscribed to their service so that makes delivery free and gives me lots of other options. Last but not least, my laundry always comes back just as requested. So the whole thing is pretty worry free"
0.0,0.1903,"They misplaced my laundry and sent me the wrong bag (everyone's nightmare).After responding promptly last night and sending me a picture of my laundry sitting in their warehouse, they have been radio silent this morning after I had requested a time of delivery. You'd think a situation like this would be top priority for their customer service team.In addition, the customer support line goes straight to voicemail so there really is no way to quickly resolve the situation and for them to provide comfort to the customer. You're stuck waiting for an e-mail response. I still have no idea where my laundry is at the moment and whether any items are missing.Of course, it's a good app and UI, but a lot of work needs to be done in back-end logistics, quality control and customer service. My local dry cleaner never misplaced my laundry in over 4 years."
6.0,0.2191,"DO NOT use this service!!!They lost 29 lbs of my laundry. And they still have no idea where it went. They also were deceitful when they initially lost my belongings- they told me twice that the delivery was just delayed. They then told me that they were sure that another customer accidentally got my things and they would return them to me shortly. This was also not true. They partially reimbursed me for my belongings and acted like they were doing me a favor by going ""to the greatest extent of their policy"" but I am still out several hundreds of dollars replacing the items that they lost.You should know that they do not actually do the laundry- they're only a middle man. You do not need this service. They make it seem like they actually do something. They do not. Just use your local laundry wash and fold- it's not worth it to lose your belongings when there's an extra transition with this unnecessary, irresponsible middle man."
